2025-08-22 17:09:17 - INFO - result/train_from_scratch/Qwen/Qwen2.5-7B-Instruct/1000addition/fne/period_base_list_[10.0]_batchsize_32_epochs_5_lr_5e-05_int_digit_len_7_frac_digit_len_5_seed42_num_train_samples_5000_model_size_level_4_lengensize_0_addlinear_True
2025-08-22 17:09:17 - INFO - Namespace(batch_size=32, epochs=5, int_digit_len=7, frac_digit_len=5, len_gen_size=0, lr=5e-05, name='', model='Qwen/Qwen2.5-7B-Instruct', dataset='Onlydrinkwater/1000addition', train_from_scratch=True, use_digit_wise_tokenizer=False, num_train_samples=5000, num_test_samples=3000, seed=42, model_size_level=4, method='fne', scheduler_name='cosine', period_base_list=[10.0], clip=False, not_add_linear=False, use_lora=False, add_linear=True)
2025-08-22 17:09:17 - INFO - Dataset specified as single name: Onlydrinkwater/1000addition
2025-08-22 17:09:21 - INFO - Model initialized from scratch with size level: 4
2025-08-22 17:09:21 - INFO - Standard tokenizer loaded.
2025-08-22 17:09:21 - INFO - Expanded tokenizer by 397 dummy tokens to match model vocab_size=152064.
2025-08-22 17:09:21 - INFO - Actual model size (total parameters): 81.79M
2025-08-22 17:09:21 - INFO - Padding token ID: 151665
2025-08-22 17:09:21 - INFO - [NUM] token ID: 151666
2025-08-22 17:09:22 - INFO - Train dataset length: 72000, Test dataset length: 20000
2025-08-22 17:09:23 - INFO - 2 data example: [{'input_ids': tensor([   220, 151666,    220,    488,    256, 151666,    220,    284,    220]), 'numbers': [678.0, 764.0], 'label': 1442.0}, {'input_ids': tensor([   220, 151666,    220,    488,    256, 151666,    220,    284,    220]), 'numbers': [365.0, 950.0], 'label': 1315.0}]
2025-08-22 17:09:23 - INFO - period_list: [0.0001, 0.001, 0.01, 0.1, 1.0, 10.0, 100.0, 1000.0, 10000.0, 100000.0, 1000000.0, 10000000.0]
2025-08-22 17:09:23 - INFO - self.powers_of_ten: tensor([           1,           10,          100,         1000,        10000,
              100000,      1000000,     10000000,    100000000,   1000000000,
         10000000000, 100000000000], device='cuda:0')
2025-08-22 17:09:23 - INFO - ----------------------------------------------------------------------------------------------------
2025-08-22 17:09:23 - INFO - Starting Epoch 1/5
2025-08-22 17:09:27 - INFO - avg Loss: 10.672341996697105
2025-08-22 17:09:27 - INFO - Evaluation start
2025-08-22 17:09:28 - INFO - Mispredictions (up to 5 examples):
2025-08-22 17:09:28 - INFO - Predicted: 51.0, Actual: 668.0
2025-08-22 17:09:28 - INFO - Predicted: 1457.0, Actual: 1697.0
2025-08-22 17:09:28 - INFO - Predicted: 750.0, Actual: 869.0
2025-08-22 17:09:28 - INFO - Predicted: 1340.0, Actual: 1470.0
2025-08-22 17:09:28 - INFO - Predicted: 952.0, Actual: 455.0
2025-08-22 17:09:28 - INFO - Epoch                                   1         
2025-08-22 17:09:28 - INFO - Train Loss                              10.6723
2025-08-22 17:09:28 - INFO - Test Loss                               6.7248
2025-08-22 17:09:28 - INFO - Whole Num Acc                           0.066667%
2025-08-22 17:09:28 - INFO - Digit-wise Acc                          39.570088%
2025-08-22 17:09:28 - INFO - MSE                                     267793.218333
2025-08-22 17:09:28 - INFO - R^2                                     -0.653598909517298
2025-08-22 17:09:28 - INFO - Learning Rate                           0.000050
2025-08-22 17:09:28 - INFO - ----------------------------------------------------------------------------------------------------
2025-08-22 17:09:28 - INFO - Starting Epoch 2/5
2025-08-22 17:09:31 - INFO - avg Loss: 6.642905663532816
2025-08-22 17:09:31 - INFO - Evaluation start
2025-08-22 17:09:32 - INFO - Mispredictions (up to 5 examples):
2025-08-22 17:09:32 - INFO - Predicted: 891.0, Actual: 668.0
2025-08-22 17:09:32 - INFO - Predicted: 1490.0, Actual: 1697.0
2025-08-22 17:09:32 - INFO - Predicted: 790.0, Actual: 869.0
2025-08-22 17:09:32 - INFO - Predicted: 1491.0, Actual: 1470.0
2025-08-22 17:09:32 - INFO - Predicted: 691.0, Actual: 455.0
2025-08-22 17:09:32 - INFO - Epoch                                   2         
2025-08-22 17:09:32 - INFO - Train Loss                              6.6429
2025-08-22 17:09:32 - INFO - Test Loss                               6.6113
2025-08-22 17:09:32 - INFO - Whole Num Acc                           0.200000%
2025-08-22 17:09:32 - INFO - Digit-wise Acc                          42.567363%
2025-08-22 17:09:32 - INFO - MSE                                     197766.018667
2025-08-22 17:09:32 - INFO - R^2                                     -0.221187283390109
2025-08-22 17:09:32 - INFO - Learning Rate                           0.000043
2025-08-22 17:09:32 - INFO - ----------------------------------------------------------------------------------------------------
2025-08-22 17:09:32 - INFO - Starting Epoch 3/5
2025-08-22 17:09:36 - INFO - avg Loss: 6.53340628192683
2025-08-22 17:09:36 - INFO - Evaluation start
2025-08-22 17:09:37 - INFO - Mispredictions (up to 5 examples):
2025-08-22 17:09:37 - INFO - Predicted: 830.0, Actual: 668.0
2025-08-22 17:09:37 - INFO - Predicted: 1549.0, Actual: 1697.0
2025-08-22 17:09:37 - INFO - Predicted: 830.0, Actual: 869.0
2025-08-22 17:09:37 - INFO - Predicted: 1330.0, Actual: 1470.0
2025-08-22 17:09:37 - INFO - Predicted: 640.0, Actual: 455.0
2025-08-22 17:09:37 - INFO - Epoch                                   3         
2025-08-22 17:09:37 - INFO - Train Loss                              6.5334
2025-08-22 17:09:37 - INFO - Test Loss                               6.5044
2025-08-22 17:09:37 - INFO - Whole Num Acc                           0.233333%
2025-08-22 17:09:37 - INFO - Digit-wise Acc                          44.783530%
2025-08-22 17:09:37 - INFO - MSE                                     169463.452333
2025-08-22 17:09:37 - INFO - R^2                                     -0.046421495381670
2025-08-22 17:09:37 - INFO - Learning Rate                           0.000025
2025-08-22 17:09:37 - INFO - ----------------------------------------------------------------------------------------------------
2025-08-22 17:09:37 - INFO - Starting Epoch 4/5
2025-08-22 17:09:40 - INFO - avg Loss: 6.457712531849078
2025-08-22 17:09:40 - INFO - Evaluation start
2025-08-22 17:09:41 - INFO - Mispredictions (up to 5 examples):
2025-08-22 17:09:41 - INFO - Predicted: 793.0, Actual: 668.0
2025-08-22 17:09:41 - INFO - Predicted: 1576.0, Actual: 1697.0
2025-08-22 17:09:41 - INFO - Predicted: 800.0, Actual: 869.0
2025-08-22 17:09:41 - INFO - Predicted: 1404.0, Actual: 1470.0
2025-08-22 17:09:41 - INFO - Predicted: 684.0, Actual: 455.0
2025-08-22 17:09:41 - INFO - Epoch                                   4         
2025-08-22 17:09:41 - INFO - Train Loss                              6.4577
2025-08-22 17:09:41 - INFO - Test Loss                               6.4509
2025-08-22 17:09:41 - INFO - Whole Num Acc                           0.166667%
2025-08-22 17:09:41 - INFO - Digit-wise Acc                          45.631244%
2025-08-22 17:09:41 - INFO - MSE                                     161180.308333
2025-08-22 17:09:41 - INFO - R^2                                     0.004726169861763
2025-08-22 17:09:41 - INFO - Learning Rate                           0.000007
2025-08-22 17:09:41 - INFO - ----------------------------------------------------------------------------------------------------
2025-08-22 17:09:41 - INFO - Starting Epoch 5/5
2025-08-22 17:09:44 - INFO - avg Loss: 6.439226688093441
2025-08-22 17:09:44 - INFO - Evaluation start
2025-08-22 17:09:45 - INFO - Mispredictions (up to 5 examples):
2025-08-22 17:09:45 - INFO - Predicted: 793.0, Actual: 668.0
2025-08-22 17:09:45 - INFO - Predicted: 1566.0, Actual: 1697.0
2025-08-22 17:09:45 - INFO - Predicted: 811.0, Actual: 869.0
2025-08-22 17:09:45 - INFO - Predicted: 1424.0, Actual: 1470.0
2025-08-22 17:09:45 - INFO - Predicted: 684.0, Actual: 455.0
2025-08-22 17:09:45 - INFO - Epoch                                   5         
2025-08-22 17:09:45 - INFO - Train Loss                              6.4392
2025-08-22 17:09:45 - INFO - Test Loss                               6.4464
2025-08-22 17:09:45 - INFO - Whole Num Acc                           0.366667%
2025-08-22 17:09:45 - INFO - Digit-wise Acc                          46.406297%
2025-08-22 17:09:45 - INFO - MSE                                     146691.244333
2025-08-22 17:09:45 - INFO - R^2                                     0.094194829969890
2025-08-22 17:09:45 - INFO - Learning Rate                           0.000000
2025-08-22 17:09:45 - INFO - Starting Final evaluation.
2025-08-22 17:09:45 - INFO - Evaluation start
2025-08-22 17:09:47 - INFO - Mispredictions (up to 5 examples):
2025-08-22 17:09:47 - INFO - Predicted: 793.0, Actual: 668.0
2025-08-22 17:09:47 - INFO - Predicted: 1566.0, Actual: 1697.0
2025-08-22 17:09:47 - INFO - Predicted: 811.0, Actual: 869.0
2025-08-22 17:09:47 - INFO - Predicted: 1424.0, Actual: 1470.0
2025-08-22 17:09:47 - INFO - Predicted: 684.0, Actual: 455.0
2025-08-22 17:09:47 - INFO - Final Test Results:
2025-08-22 17:09:47 - INFO - Test Loss                               6.4464
2025-08-22 17:09:47 - INFO - Whole Num Accuracy                      0.366667%
2025-08-22 17:09:47 - INFO - Digit-wise Accuracy                     46.406297%
2025-08-22 17:09:47 - INFO - MSE                                     146691.244333
2025-08-22 17:09:47 - INFO - R^2                                     0.094194829969890
